pali_3386|(ජරාමරණං භික්ඛවෙ අජානතා අපස්සතා යථාභූතං ජරාමරණෙ යථාභූතංඤාණාය) සාතච්චං කරණීයන්ති.|(jarāmaraṇaṁ bhikkhave ajānatā apassatā yathābhūtaṁ jarāmaraṇe yathābhūtaṁñāṇāya) sātaccaṁ karaṇīyanti.|default
pali_2145|යදි ඛත්තියො භවති භූමිපති x අවිභෙදියා'ස්ස පරිසා භවන්ති x සමණො ච හොති විරජො වීතමලො x පරිසා'ස්ස හොති අනුගතා අචලා'ති.|yadi khattiyo bhavati bhūmipati x avibhediyā'ssa parisā bhavanti x samaṇo ca hoti virajo vītamalo x parisā'ssa hoti anugatā acalā'ti.|gatha
pali_0088|අක්ඛෙහි දිබ්බන්ති සුරං පිවන්ති x යන්තිත්ථියො පාණසමා පරෙසං x නිහීනසෙවී න ච වුද්ධසෙවි x නිහීයරෙ කාළපක්ඛෙ'ව චන්දො. ()|akkhehi dibbanti suraṁ pivanti x yantitthiyo pāṇasamā paresaṁ x nihīnasevī na ca vuddhasevi x nihīyare kāḷapakkhe'va cando. ()|gatha
pali_0089|(අම්බපාලිවනෙ සතිපට්ඨාන දෙසනා)|(ambapālivane satipaṭṭhāna desanā)|default
pali_2983|එසා භික්ඛවෙ තුලා, එතං පමාණං, සාවකානං භික්ඛූනං යදිදං සාරිපුත්තමොග්ගලානා .|esā bhikkhave tulā, etaṁ pamāṇaṁ, sāvakānaṁ bhikkhūnaṁ yadidaṁ sāriputtamoggalānā .|default
pali_0090|අහිරිකඤ්ච අනොත්තප්පඤ්ච.|ahirikañca anottappañca.|default
pali_1829|යථා කථං පන තුම්හෙ අනුරුද්ධා, සමග්ගා සම්මොදමානා අවිවදමානා ඛීරොදකීභූතා අඤ්ඤමඤ්ඤං පියචක්ඛූහි සම්පස්සන්තා විහරථා'ති.|yathā kathaṁ pana tumhe anuruddhā, samaggā sammodamānā avivadamānā khīrodakībhūtā aññamaññaṁ piyacakkhūhi sampassantā viharathā'ti.|default
pali_1977|කාමං මඤ්ඤතු වා මා වා භයා ම්යායං තිතික්ඛති, x සදත්ථපරමා අත්ථා ඛන්ත්යා භිය්යො න විජ්ජති.|kāmaṁ maññatu vā mā vā bhayā myāyaṁ titikkhati, x sadatthaparamā atthā khantyā bhiyyo na vijjati.|gatha
pali_2034|සමණො ඛලු භො ගොතමො කල්යාණවාචො කල්යාණවාක්කරණො පොරියා වාචාය සමන්නාගතො විස්සට්ඨාය අනෙලගලාය අත්ථස්ස විඤ්ඤාපනියා.|samaṇo khalu bho gotamo kalyāṇavāco kalyāṇavākkaraṇo poriyā vācāya samannāgato vissaṭṭhāya anelagalāya atthassa viññāpaniyā.|default
pali_2035|චිරස්සං වත පස්සාමි බ්රාහ්මණං පරිනිබ්බුතං, x අනන්දිං අනඝං භික්ඛුං තිණ්ණං ලොකෙ විසත්තිකන්ති.|cirassaṁ vata passāmi brāhmaṇaṁ parinibbutaṁ, x anandiṁ anaghaṁ bhikkhuṁ tiṇṇaṁ loke visattikanti.|gatha
pali_1602|චත්තාරො අරියවොහාරා: මුසාවාදා වෙරමණී, පිසුණාය වාචාය වෙරමණී, ඵරුසාය වාචාය වෙරමණී, සම්ඵප්පලාපා වෙරමණී.|cattāro ariyavohārā: musāvādā veramaṇī, pisuṇāya vācāya veramaṇī, pharusāya vācāya veramaṇī, samphappalāpā veramaṇī.|default
pali_1978|යො හවෙ බලවා සන්තො දුබ්බලස්ස තිතික්ඛති, x තමාහු පරමං ඛන්තිං නිච්චං ඛමති දුබ්බලො.|yo have balavā santo dubbalassa titikkhati, x tamāhu paramaṁ khantiṁ niccaṁ khamati dubbalo.|gatha
pali_2565|එකමන්තං නිසින්නං ඛො රාජානං පසෙනදිං කොසලං භගවා එතදවොච: හන්ද කුතො නු ත්වං මහාරාජ ආගච්ඡසි දිවා දිවස්සාති?|ekamantaṁ nisinnaṁ kho rājānaṁ pasenadiṁ kosalaṁ bhagavā etadavoca: handa kuto nu tvaṁ mahārāja āgacchasi divā divassāti?|default
pali_1314|(සබ්බෙසං චතුසච්චිකං කාතබ්බං)|(sabbesaṁ catusaccikaṁ kātabbaṁ)|default
pali_0091|ගන්ධඤ්ච ඝාත්වා සුරභිං මනොරමං x අථොපි ඝාත්වා අසුචිං අකන්තියං x අකන්තියස්මිං පටිඝං විනොදයෙ x ඡන්දානුනීතො නච කන්තියෙ සියා.|gandhañca ghātvā surabhiṁ manoramaṁ x athopi ghātvā asuciṁ akantiyaṁ x akantiyasmiṁ paṭighaṁ vinodaye x chandānunīto naca kantiye siyā.|gatha
pali_2890|තං කිම්මඤ්ඤසි වාසෙට්ඨ, කින්ති තෙ සුතං බ්රාහ්මණානං වුද්ධානං මහල්ලකානං ආචරියපාචරියානං භාසමානානං:|taṁ kimmaññasi vāseṭṭha, kinti te sutaṁ brāhmaṇānaṁ vuddhānaṁ mahallakānaṁ ācariyapācariyānaṁ bhāsamānānaṁ:|default
pali_0092|තිවිධෙන රූපසඞ්ගහො: සනිදස්සනසප්පටිඝං රූපං, අනිදස්සනසප්පටිඝං රූපං, අනිදස්සනඅප්පටිඝං රූපං.|tividhena rūpasaṅgaho: sanidassanasappaṭighaṁ rūpaṁ, anidassanasappaṭighaṁ rūpaṁ, anidassanaappaṭighaṁ rūpaṁ.|default
pali_3387|(ජරාමරණං භික්ඛවෙ අජානතා අපස්සතා යථාභූතං ජරාමරණෙ යථාභූතංඤාණාය) උස්සොළ්හී කරණීයාති.|(jarāmaraṇaṁ bhikkhave ajānatā apassatā yathābhūtaṁ jarāmaraṇe yathābhūtaṁñāṇāya) ussoḷhī karaṇīyāti.|default
pali_0093|අථාපරෙසං එකතො පක්ඛිකානං භික්ඛූනං බ්යත්තතරෙන භික්ඛුනා උට්ඨායාසනා එකංසං චීවරං කත්වා අඤ්ජලිම්පණාමෙත්වා සඞ්ඝො ඤාපෙතබ්බො :|athāparesaṁ ekato pakkhikānaṁ bhikkhūnaṁ byattatarena bhikkhunā uṭṭhāyāsanā ekaṁsaṁ cīvaraṁ katvā añjalimpaṇāmetvā saṅgho ñāpetabbo :|default
pali_1830|කෙ ච තෙ අතරුං සඞ්ගං මච්චුධෙය්යං සුදුත්තරං, x කෙ හිත්වා මානුසං දෙහං දිබ්බං යොගං උපච්චගුං.|ke ca te ataruṁ saṅgaṁ maccudheyyaṁ suduttaraṁ, x ke hitvā mānusaṁ dehaṁ dibbaṁ yogaṁ upaccaguṁ.|gatha
pali_2891|චිත්තුප්පාදම්පි ඛො අහං චුන්ද කුසලෙසු ධම්මෙසු බහුකාරං වදාමි. කො පන වාදො කායෙන වාචාය අනුවිධීයනාසු.|cittuppādampi kho ahaṁ cunda kusalesu dhammesu bahukāraṁ vadāmi. ko pana vādo kāyena vācāya anuvidhīyanāsu.|default
pali_1831|අන්තො ජටා බහි ජටා ජටාය ජටිතා පජා, x තං තං ගොතම පුච්ඡාමි කො ඉමං විජටයෙ ජටන්ති.|anto jaṭā bahi jaṭā jaṭāya jaṭitā pajā, x taṁ taṁ gotama pucchāmi ko imaṁ vijaṭaye jaṭanti.|gatha
pali_1494|අතීත දුක්ඛ, අනාගත දුක්ඛ, පච්චුප්පන්න දුක්ඛසුත්තානි|atīta dukkha, anāgata dukkha, paccuppanna dukkhasuttāni|default
pali_3294|තෙසං ඛො පන භික්ඛු, චතුරාසීතියා පාසාදසහස්සානං එකොයෙව පාසාදො හොති යමහං තෙන සමයෙන අජ්ඣාවසාමි ධම්මපාසාදො.|tesaṁ kho pana bhikkhu, caturāsītiyā pāsādasahassānaṁ ekoyeva pāsādo hoti yamahaṁ tena samayena ajjhāvasāmi dhammapāsādo.|default
pali_2846|සත්තරතනං වා සො ආවුසො නාගං අඩ්ඪට්ඨරතනං වා තාලපත්තිකාය ඡාදෙතබ්බං මඤ්ඤෙය්ය, යො මෙ ඡ අභිඤ්ඤා ඡාදෙතබ්බං මඤ්ඤෙය්යාති.|sattaratanaṁ vā so āvuso nāgaṁ aḍḍhaṭṭharatanaṁ vā tālapattikāya chādetabbaṁ maññeyya, yo me cha abhiññā chādetabbaṁ maññeyyāti.|default
pali_1979|සචෙ න පබ්බජ්ජමුපෙති තාදිසො, x වත්තෙති චක්කං පඨවිං පසාසති x තස්සානුයුත්තා'ධ භවන්ති ඛත්තියා x මහායසං සම්පරිවාරයන්ති නං.|sace na pabbajjamupeti tādiso, x vatteti cakkaṁ paṭhaviṁ pasāsati x tassānuyuttā'dha bhavanti khattiyā x mahāyasaṁ samparivārayanti naṁ.|gatha
pali_1758|තතියම්පි ඛො කොකාලිකො භික්ඛු භගවන්තං එතදවොච:. පාපිකානං ඉච්ඡානං වසං ගතාති.|tatiyampi kho kokāliko bhikkhu bhagavantaṁ etadavoca:. pāpikānaṁ icchānaṁ vasaṁ gatāti.|default
pali_0094|අත්ථි භන්තෙ, පුබ්බචීරං නාම වජ්ජිගාමො. තත්ථායස්මතො ඡන්නස්ස මිත්තකුලානි සුහජ්ජකුලානි උපවජ්ජකුලානීති.|atthi bhante, pubbacīraṁ nāma vajjigāmo. tatthāyasmato channassa mittakulāni suhajjakulāni upavajjakulānīti.|default
pali_1759|'යස්සදානි මාණවක, බ්රහ්මායු බ්රාහ්මණො කාලං මඤ්ඤතී'ති.|'yassadāni māṇavaka, brahmāyu brāhmaṇo kālaṁ maññatī'ti.|default
pali_1760|දීඝරත්තමනුසයිතං දිට්ඨීගතමජානතං x අජානන්තා නො පබ්රුවන්ති ජාතියා හොති බ්රාහ්මණො.|dīgharattamanusayitaṁ diṭṭhīgatamajānataṁ x ajānantā no pabruvanti jātiyā hoti brāhmaṇo.|gatha
pali_1832|ඉමානි පඤ්ච භයානි වෙරානි වූපසන්තාතිහොන්ති.|imāni pañca bhayāni verāni vūpasantātihonti.|default
pali_1315|කින්නු උද්දිස්ස මුණ්ඩාසි සමණී විය දිස්සසි, x න ච රොචෙසි පාසණ්ඩං කිමිව චරසි මොමූහාති.|kinnu uddissa muṇḍāsi samaṇī viya dissasi, x na ca rocesi pāsaṇḍaṁ kimiva carasi momūhāti.|gatha
pali_0866|අකතං දුක්කතං සෙය්යො පච්ඡා තපති දුක්කතං, x කතඤ්ච සුකතං සෙය්යො යං කත්වා නානුතප්පති.|akataṁ dukkataṁ seyyo pacchā tapati dukkataṁ, x katañca sukataṁ seyyo yaṁ katvā nānutappati.|gatha
pali_1603|ඨිතෙ මජ්ඣන්තිකෙ කාලෙ සන්නිසීවෙසු පක්ඛිසු, x සණතෙව බ්රහාරඤ්ඤං 'සා රතී පටිභාති මන්ති.|ṭhite majjhantike kāle sannisīvesu pakkhisu, x saṇateva brahāraññaṁ 'sā ratī paṭibhāti manti.|gatha
pali_1604|ඨිතෙ මජ්ඣන්හිකෙ කාලෙ සන්නිසීවෙසු පක්ඛිසු, x සණතෙව බ්රහාරඤ්ඤං තං භයං පටිභාති මන්ති.|ṭhite majjhanhike kāle sannisīvesu pakkhisu, x saṇateva brahāraññaṁ taṁ bhayaṁ paṭibhāti manti.|gatha
pali_0867|එවං මහත්ථියො ඛො භික්ඛවෙ ධම්මාභිසමයො, එවං මහත්ථියො ධම්මචක්ඛු පටිලාභොති.|evaṁ mahatthiyo kho bhikkhave dhammābhisamayo, evaṁ mahatthiyo dhammacakkhu paṭilābhoti.|default
pali_1833|යාවකීවඤ්ච භික්ඛවෙ, භික්ඛූ උප්පන්නාය තණ්හාය පොනොභවිකාය න වසං ගච්ඡන්ති, වුද්ධියෙව භික්ඛවෙ, භික්ඛූනං පාටිකඞ්ඛා නො පරිහානි. ()|yāvakīvañca bhikkhave, bhikkhū uppannāya taṇhāya ponobhavikāya na vasaṁ gacchanti, vuddhiyeva bhikkhave, bhikkhūnaṁ pāṭikaṅkhā no parihāni. ()|default
pali_2185|'පඤ්ඤං නප්පමජ්ජෙය්ය, සච්චමනුරක්ඛෙය්ය, චාගමනුබ්රූහෙය්ය, සන්තිමෙව සො සික්ඛෙය්යා'ති ඉති යං තං වුත්තං, ඉදමෙතං පටිච්ච වුත්තං.|'paññaṁ nappamajjeyya, saccamanurakkheyya, cāgamanubrūheyya, santimeva so sikkheyyā'ti iti yaṁ taṁ vuttaṁ, idametaṁ paṭicca vuttaṁ.|default
pali_2566|ත්වං පනාවුසො, ධාරෙසි භද්දෙකරත්තස්ස උද්දෙසඤ්ච විභඞ්ගඤ්චාති?|tvaṁ panāvuso, dhāresi bhaddekarattassa uddesañca vibhaṅgañcāti?|default
pali_2186|න හි නූනිමස්ස සමණස්ස තුච්ඡකොට්ඨස්මිං මූසිකා, x උස්සොළ්හිකාය නච්චන්ති තෙනායං සමණො සුඛී.|na hi nūnimassa samaṇassa tucchakoṭṭhasmiṁ mūsikā, x ussoḷhikāya naccanti tenāyaṁ samaṇo sukhī.|gatha
pali_1316|සුඛිනියො හොන්තු මහාරාජ, සොමා ච භගිනී සකුලා ච භගිනීති.|sukhiniyo hontu mahārāja, somā ca bhaginī sakulā ca bhaginīti.|default
pali_3295|තෙන හි තං වඞ්ගීස භිය්යොසොමත්තාය පුබ්බෙ අපරිවිතක්කිතා ගාථායො පටිභන්තූති.|tena hi taṁ vaṅgīsa bhiyyosomattāya pubbe aparivitakkitā gāthāyo paṭibhantūti.|default
pali_0095|චත්තාරි පධානානි: සංවරප්පධානං, පහානප්පධානං, භාවනාප්පධානං, අනුරක්ඛණප්පධානං.|cattāri padhānāni: saṁvarappadhānaṁ, pahānappadhānaṁ, bhāvanāppadhānaṁ, anurakkhaṇappadhānaṁ.|default
pali_1317|සත්තාහපබ්බජිතෙ ඛො පන භික්ඛවෙ, රාජිසිම්හි දිබ්බං චක්කරතනං අන්තරධායි.|sattāhapabbajite kho pana bhikkhave, rājisimhi dibbaṁ cakkaratanaṁ antaradhāyi.|default
pali_0868|විනයස්සු මයි කඞ්ඛං අධිමුච්චස්සු බ්රාහ්මණ, x දුල්ලභං දස්සනං හොති සම්බුද්ධානං අභිණ්හසො.|vinayassu mayi kaṅkhaṁ adhimuccassu brāhmaṇa, x dullabhaṁ dassanaṁ hoti sambuddhānaṁ abhiṇhaso.|gatha
pali_1318|අජෙළකා ච ගාවො ච විවිධා යත්ථ හඤ්ඤරෙ, x න තං සම්මග්ගතා යඤ්ඤං උපයන්ති මහෙසිනො.|ajeḷakā ca gāvo ca vividhā yattha haññare, x na taṁ sammaggatā yaññaṁ upayanti mahesino.|gatha
pali_2892|තථා නු ත්වං පාපිම අකාසි, යථා'හං පිණ්ඩං න ලභෙය්යන්ති.|tathā nu tvaṁ pāpima akāsi, yathā'haṁ piṇḍaṁ na labheyyanti.|default
pali_1182|රුක්ඛමූලගහණං පසක්කිය නිබ්බානං හදයස්මිං ඔපිය, x ඣාය ගොතම මා ච පමාදො කිං තෙ බිළිබිළිකා කරිස්සතීති.|rukkhamūlagahaṇaṁ pasakkiya nibbānaṁ hadayasmiṁ opiya, x jhāya gotama mā ca pamādo kiṁ te biḷibiḷikā karissatīti.|gatha
pali_3443|සාධු භික්ඛවෙ, එතම්පි ඛො භික්ඛවෙ, අට්ඨානං අනවකාසො, යං අසප්පුරිසො සප්පුරිසං ජානෙය්ය 'සප්පුරිසො අයං භව'න්ති.|sādhu bhikkhave, etampi kho bhikkhave, aṭṭhānaṁ anavakāso, yaṁ asappuriso sappurisaṁ jāneyya 'sappuriso ayaṁ bhava'nti.|default
pali_0869|අතිසීතං අතිඋණ්හං අතිසායමිදං අහු, x ඉති විස්සට්ඨකම්මන්තෙ අත්ථා අච්චෙන්ති මාණවෙ. ()|atisītaṁ atiuṇhaṁ atisāyamidaṁ ahu, x iti vissaṭṭhakammante atthā accenti māṇave. ()|gatha
pali_3359|නමො තස්ස භගවතො අරහතො සම්මා සම්බුද්ධස්ස|namo tassa bhagavato arahato sammā sambuddhassa|default
pali_0096|අසඤ්ඤසත්තායතනං, නෙවසඤ්ඤානාසඤ්ඤායතනමෙව දුතියං.|asaññasattāyatanaṁ, nevasaññānāsaññāyatanameva dutiyaṁ.|default
pali_0870|'අපාරුතා තෙසං අමතස්ස ද්වාරා x යෙ සොතවන්තො පමුඤ්චන්තු සද්ධං x විහිංසසඤ්ඤී පගුණං න භාසිංධ x ම්මං පනෙතං මනුජෙසු බ්රහ්මෙ'ති.|'apārutā tesaṁ amatassa dvārā x ye sotavanto pamuñcantu saddhaṁ x vihiṁsasaññī paguṇaṁ na bhāsiṁdha x mmaṁ panetaṁ manujesu brahme'ti.|gatha
pali_1495|යෙ ච යඤ්ඤා නිරාරම්භා යජන්ති අනුකුලං සදා, x අජෙළකා ච ගාවො ච විවිධා නෙත්ථ හඤ්ඤරෙ|ye ca yaññā nirārambhā yajanti anukulaṁ sadā, x ajeḷakā ca gāvo ca vividhā nettha haññare|gatha
pali_2267|ජානාසි නො ත්වං මාරිස, සත්තානං නිමොක්ඛං පමොක්ඛං විවෙකන්ති?|jānāsi no tvaṁ mārisa, sattānaṁ nimokkhaṁ pamokkhaṁ vivekanti?|default
pali_2036|සෙය්යථාපි ආවුසො, උදකරහදො ගම්භීරො උබ්භිදොදකො - (යථා සාමඤ්ඤඵලෙ එවං විත්ථාරෙතබ්බං.)|seyyathāpi āvuso, udakarahado gambhīro ubbhidodako - (yathā sāmaññaphale evaṁ vitthāretabbaṁ.)|default
pali_2268|'සුතම්මෙතං භන්තෙ, වජ්ජී යා තා කුලිත්ථියො කුලකුමාරියො, තා න ඔක්කස්ස පසය්හ වාසෙන්තී'ති.|'sutammetaṁ bhante, vajjī yā tā kulitthiyo kulakumāriyo, tā na okkassa pasayha vāsentī'ti.|default
pali_2953|සමණං ඛලු භො ගොතමං රාජා මාගධො සෙනියො බිම්බිසාරො සපුත්තදාරො පාණෙහි සරණං ගතො.|samaṇaṁ khalu bho gotamaṁ rājā māgadho seniyo bimbisāro saputtadāro pāṇehi saraṇaṁ gato.|default
pali_2698|අච්ඡරියං භන්තෙ! අබ්භුතං භන්තෙ! නිස්සාය නිස්සාය කිර නො භන්තෙ, භගවතා ඔඝස්ස නිත්ථරණා අක්ඛාතා. කතමො පන භන්තෙ, අරියො විමොක්ඛොති.|acchariyaṁ bhante! abbhutaṁ bhante! nissāya nissāya kira no bhante, bhagavatā oghassa nittharaṇā akkhātā. katamo pana bhante, ariyo vimokkhoti.|default
pali_3048|සම්මාදස්සනං ඛො රාධ, නිබ්බිදත්ථං.|sammādassanaṁ kho rādha, nibbidatthaṁ.|default
pali_2567|උළාරාය ඛලු භවං භාරද්වාජො සමණං ගොතමං පසංසාය පසංසතීති.|uḷārāya khalu bhavaṁ bhāradvājo samaṇaṁ gotamaṁ pasaṁsāya pasaṁsatīti.|default
pali_2984|කිත්තාවතා පන භන්තෙ, ඨානාඨානකුසලො භික්ඛූති අලං වචනායාති.|kittāvatā pana bhante, ṭhānāṭhānakusalo bhikkhūti alaṁ vacanāyāti.|default
pali_1319|(සබ්බත්ථ අතීතානාගත පච්චුප්පන්නං කාතබ්බං.)|(sabbattha atītānāgata paccuppannaṁ kātabbaṁ.)|default
pali_3444|උද්දෙසවිභඞ්ග සුත්තං අට්ඨමං.|uddesavibhaṅga suttaṁ aṭṭhamaṁ.|default
pali_2515|සතුල්ලපකායිකවග්ගො චතුත්ථො.|satullapakāyikavaggo catuttho.|gatha
pali_0097|පාපමිත්තො පාපසඛො පාපආචාරගොචරො x අස්මා ලොකා පරම්හා ච උභයා ධංසතෙ නරො. ()|pāpamitto pāpasakho pāpaācāragocaro x asmā lokā paramhā ca ubhayā dhaṁsate naro. ()|gatha
pali_0098|ඡ අනුස්සතිට්ඨානානි: බුද්ධානුස්සති, ධම්මානුස්සති, සඞ්ඝානුස්සති, සීලානුස්සති, චාගානුස්සති, දෙවතානුස්සති.|cha anussatiṭṭhānāni: buddhānussati, dhammānussati, saṅghānussati, sīlānussati, cāgānussati, devatānussati.|default
pali_3160|පුන චපරං ආවුසො දුස්සීලො සීලවිපන්නො සම්මූළ්හො කාලං කරොති, අයං චතුත්ථො ආදීනවො දුස්සීලස්ස සීලවිපත්තියා.|puna caparaṁ āvuso dussīlo sīlavipanno sammūḷho kālaṁ karoti, ayaṁ catuttho ādīnavo dussīlassa sīlavipattiyā.|default
pali_1320|එත්ථදානි සුසීම, ඉදඤ්ච වෙය්යාකරණං ඉමෙසඤ්ච ධම්මානං අසමාපත්ති. ඉදං නො සුසීම, කථන්ති?|etthadāni susīma, idañca veyyākaraṇaṁ imesañca dhammānaṁ asamāpatti. idaṁ no susīma, kathanti?|default
pali_1605|ධම්මංයෙව නිස්සාය. බ්රාහ්මණගහපතිකෙසු,|dhammaṁyeva nissāya. brāhmaṇagahapatikesu,|default
pali_0099|චත්තාරි සාමඤ්ඤඵලානි: සොතාපත්තිඵලං, සකදාගාමිඵලං, අනාගාමිඵලං, අරහත්තඵලං.|cattāri sāmaññaphalāni: sotāpattiphalaṁ, sakadāgāmiphalaṁ, anāgāmiphalaṁ, arahattaphalaṁ.|default
pali_1321|'යජතං භවං රාජා යඤ්ඤං. යඤ්ඤකාලො මහාරාජා'ති.|'yajataṁ bhavaṁ rājā yaññaṁ. yaññakālo mahārājā'ti.|default
pali_3207|එවං ඛො රාහුල, ජානතො එවං පස්සතො ඉමස්මිඤ්ච සවිඤ්ඤාණකෙ කායෙ බහිද්ධා ච සබ්බනිමිත්තෙසු අහිඞ්කාරමමිඞ්කාරමානානුසයා න හොන්තී'ති.|evaṁ kho rāhula, jānato evaṁ passato imasmiñca saviññāṇake kāye bahiddhā ca sabbanimittesu ahiṅkāramamiṅkāramānānusayā na hontī'ti.|default
pali_1322|'සචෙ ඛො ත්වං අය්යෙ අගාරස්මා අනගාරියං පබ්බජසි, තාදිසා අය්යෙ භවාහි, යාදිසා ඛෙමා ච භික්ඛුනී, උප්පලවණ්ණාචා'ති.|'sace kho tvaṁ ayye agārasmā anagāriyaṁ pabbajasi, tādisā ayye bhavāhi, yādisā khemā ca bhikkhunī, uppalavaṇṇācā'ti.|default
pali_3208|යම්පි කෙවඩ්ඪ, භික්ඛු එවං සමාහිතෙ චිත්තෙ පරිසුද්ධෙ. උභො සද්දෙ සුණාති දිබ්බෙ ච මානුසෙ ච යෙ දූරෙ සන්තිකෙ ච, ඉදම්පි'ස්ස හොති පඤ්ඤාය.|yampi kevaḍḍha, bhikkhu evaṁ samāhite citte parisuddhe. ubho sadde suṇāti dibbe ca mānuse ca ye dūre santike ca, idampi'ssa hoti paññāya.|default
pali_0100|පඤ්චුද්ධම්භාගියානි සංයොජනානි: රූපරාගො, අරූපරාගො, මානො, උද්ධච්චං, අවිජ්ජා.|pañcuddhambhāgiyāni saṁyojanāni: rūparāgo, arūparāgo, māno, uddhaccaṁ, avijjā.|default
