pali_1772|නක්ඛත්තානං මුඛං චන්දො ආදිච්චො තපතං මුඛං, x පුඤ්ඤං ආකඞ්ඛමානානං සඞ්ඝො වෙ යජතං මුඛ'න්ති.|nakkhattānaṁ mukhaṁ cando ādicco tapataṁ mukhaṁ, x puññaṁ ākaṅkhamānānaṁ saṅgho ve yajataṁ mukha'nti.|gatha
pali_1196|තෙ චෙතසා අනුපරියෙති මොග්ගල්ලානො මහිද්ධිකො, x චිත්තං නෙසං සමන්නෙසං විප්පමුත්තං නිරූපධිං.|te cetasā anupariyeti moggallāno mahiddhiko, x cittaṁ nesaṁ samannesaṁ vippamuttaṁ nirūpadhiṁ.|gatha
pali_2278|කින්නු ජාතිං න රොචෙසි ජාතො කාමානි භුඤ්ජති, x කො නු තං ඉදමාදපයි ජාතිං මාරොච භික්ඛුනීති.|kinnu jātiṁ na rocesi jāto kāmāni bhuñjati, x ko nu taṁ idamādapayi jātiṁ māroca bhikkhunīti.|gatha
pali_1643|චිරස්සං වත පස්සාමි බ්රාහ්මණං පරිනිබ්බුතං, x අප්පතිට්ඨං අනායූහං තිණ්ණං ලොකෙ විසත්තිකං.|cirassaṁ vata passāmi brāhmaṇaṁ parinibbutaṁ, x appatiṭṭhaṁ anāyūhaṁ tiṇṇaṁ loke visattikaṁ.|gatha
pali_0173|ආතුරස්සෙව භෙසජ්ජං, භොජනං'ව ජිඝච්ඡතො, x පරිනිබ්බාපය මං භද්දෙ ජලන්තමිව වාරිනා.|āturasseva bhesajjaṁ, bhojanaṁ'va jighacchato, x parinibbāpaya maṁ bhadde jalantamiva vārinā.|gatha
pali_1871|යෙ ච ඛො අරියධම්මෙ x ඛන්තියා උපසමෙන උපෙතා, x පහාය මානුසං දෙහං x දෙවකායං පරිපූරෙස්සන්තී'ති.|ye ca kho ariyadhamme x khantiyā upasamena upetā, x pahāya mānusaṁ dehaṁ x devakāyaṁ paripūressantī'ti.|gatha
pali_0174|අච්චයං දෙසයන්තීනං යො චෙ න පටිගණ්හති, x කොපන්තරො දොසගරු ස වෙරං පටිමුච්චති.|accayaṁ desayantīnaṁ yo ce na paṭigaṇhati, x kopantaro dosagaru sa veraṁ paṭimuccati.|gatha
pali_2211|'සබ්බෙව නු ඛො මාරිස, සමණබ්රාහ්මණා අච්චන්තනිට්ඨා අච්චන්තයොගක්ඛෙමී අච්චන්තබ්රහ්මචාරී අච්චන්තපරියොසානා?'ති.|'sabbeva nu kho mārisa, samaṇabrāhmaṇā accantaniṭṭhā accantayogakkhemī accantabrahmacārī accantapariyosānā?'ti.|default
pali_0943|ඉස්සත්ථං බලවිරියඤ්ච යස්මිං විජ්ජෙථ මාණවෙ, x තං යුද්ධත්ථො භරෙ රාජා නාසූරං ජාතිපච්චයා.|issatthaṁ balaviriyañca yasmiṁ vijjetha māṇave, x taṁ yuddhattho bhare rājā nāsūraṁ jātipaccayā.|gatha
pali_3088|රූපා භික්ඛවෙ, අනත්තා. යදනත්තා තං 'නෙතං මම, නෙසො'හමස්මි, න මෙසො අත්තා'ති එවමෙතං යථාභූතං සම්මප්පඤ්ඤාය දට්ඨබ්බං.|rūpā bhikkhave, anattā. yadanattā taṁ 'netaṁ mama, neso'hamasmi, na meso attā'ti evametaṁ yathābhūtaṁ sammappaññāya daṭṭhabbaṁ.|default
pali_0944|තස්මා අඛිලොධ පධානවා නීවරණානි පහාය විසුද්ධො, x මානඤ්ච පහාය අසෙසං විජ්ජායන්තකරො සමිතාවීති.|tasmā akhilodha padhānavā nīvaraṇāni pahāya visuddho, x mānañca pahāya asesaṁ vijjāyantakaro samitāvīti.|gatha
pali_2149|තදඞ්ගෙන ඛො ආවුසො කච්චාන, සන්ති පන එත්ථ එකච්චා දෙවතා පරිත්තාභා, සන්ති පනෙත්ථෙකච්චා දෙවතා අප්පමාණාභාති.|tadaṅgena kho āvuso kaccāna, santi pana ettha ekaccā devatā parittābhā, santi panetthekaccā devatā appamāṇābhāti.|default
pali_1644|බහුම්පි පලපං ජප්පං න ජච්චා හොති බ්රාහ්මණො, x අන්තො කසම්බුසංකිලිට්ඨො කුහනා පරිවාරිතො.|bahumpi palapaṁ jappaṁ na jaccā hoti brāhmaṇo, x anto kasambusaṁkiliṭṭho kuhanā parivārito.|gatha
pali_1645|සබ්බදා සීලසම්පන්නො පඤ්ඤවා සුසමාහිතො, x ආරද්ධවිරියො පහිතත්තො ඔඝං තරති දුත්තරං.|sabbadā sīlasampanno paññavā susamāhito, x āraddhaviriyo pahitatto oghaṁ tarati duttaraṁ.|gatha
pali_3424|යං ඛො නො ආවුසො, භගවා සංඛිත්තෙන උද්දෙසං උද්දිසිත්වා විත්ථාරෙන අත්ථං අවිභජිත්වා උට්ඨායාසනා විහාරං පවිට්ඨො:|yaṁ kho no āvuso, bhagavā saṁkhittena uddesaṁ uddisitvā vitthārena atthaṁ avibhajitvā uṭṭhāyāsanā vihāraṁ paviṭṭho:|default
pali_1872|කුසලී භාසසි තෙසං මාරපාසප්පහායිනං, x කස්ස තෙ ධම්මමඤ්ඤාය අච්ඡිදුං භවබන්ධනං.|kusalī bhāsasi tesaṁ mārapāsappahāyinaṁ, x kassa te dhammamaññāya acchiduṁ bhavabandhanaṁ.|gatha
pali_0945|චිරස්සං වත මෙ මහිතො මහෙසී x මහාවනං සමණොයං පච්චුපාදි, x සොහං චිරස්සාපි පහස්සං x පාපං සුත්වාන ගාථං තව ධම්මයුත්තං'.|cirassaṁ vata me mahito mahesī x mahāvanaṁ samaṇoyaṁ paccupādi, x sohaṁ cirassāpi pahassaṁ x pāpaṁ sutvāna gāthaṁ tava dhammayuttaṁ'.|gatha
pali_1197|සචෙ ලභෙථ නිපකං සහායං සද්ධිං චරං සාධුවිහාරි ධීරං, x අභිභුය්ය සබ්බානි පරිස්සයානි චරෙය්ය තෙනත්තමනො සතීමා.|sace labhetha nipakaṁ sahāyaṁ saddhiṁ caraṁ sādhuvihāri dhīraṁ, x abhibhuyya sabbāni parissayāni careyya tenattamano satīmā.|gatha
pali_1773|එවම්පි ඛො භග්ගව, සුනක්ඛත්තො ලිච්ඡවිපුත්තො මයා වුච්චමානො අපක්කමෙව ඉමස්මා ධම්මවිනයා යථා තං ආපාධිකො නෙරයිකො.|evampi kho bhaggava, sunakkhatto licchaviputto mayā vuccamāno apakkameva imasmā dhammavinayā yathā taṁ āpādhiko nerayiko.|default
pali_2212|එවං මල්ලිකෙ, පියා මෙසි ත්වන්ති.|evaṁ mallike, piyā mesi tvanti.|default
pali_0946|අථ ඛො භගවා යථාධොතෙන පත්තෙන පඤ්චසාලං බ්රාහ්මණගාමං පිණ්ඩාය පාවිසි. තථාධොතෙන පත්තෙන පටික්කමි.|atha kho bhagavā yathādhotena pattena pañcasālaṁ brāhmaṇagāmaṁ piṇḍāya pāvisi. tathādhotena pattena paṭikkami.|default
pali_2911|'අන්තරායකරො සමානො ලොහිච්ච හිතානුකම්පී වා තෙසං හොති අහිතානුකම්පී වා'?ති.|'antarāyakaro samāno lohicca hitānukampī vā tesaṁ hoti ahitānukampī vā'?ti.|default
pali_2912|අථද්දසං භික්ඛවො දිට්ඨපුබ්බෙ ගන්ධබ්බකායූපගතෙ'වහීනෙ. x ඉමෙහි තෙ ගොතමසාවකා සෙ යෙ ච මයං පුබ්බෙ මනුස්සභූතා.|athaddasaṁ bhikkhavo diṭṭhapubbe gandhabbakāyūpagate'vahīne. x imehi te gotamasāvakā se ye ca mayaṁ pubbe manussabhūtā.|gatha
pali_1646|නාඤ්ඤත්ර බොජ්ඣඞ්ගා තපසා නාඤ්ඤත්ර ඉන්ද්රියසංවරා, x නාඤ්ඤත්ර සබ්බනිස්සග්ගා සොත්ථිං පස්සාමි පාණිනන්ති.|nāññatra bojjhaṅgā tapasā nāññatra indriyasaṁvarā, x nāññatra sabbanissaggā sotthiṁ passāmi pāṇinanti.|gatha
pali_1989|එවං භද්දන්තවාති ඛො භික්ඛවෙ මාතලි සඞ්ගාහකො සක්කස්ස දෙවානමින්දස්ස පටිස්සුත්වා සහස්සයුත්තං ආජඤ්ඤරථං පච්චුදාවත්තෙසි.|evaṁ bhaddantavāti kho bhikkhave mātali saṅgāhako sakkassa devānamindassa paṭissutvā sahassayuttaṁ ājaññarathaṁ paccudāvattesi.|default
pali_2150|සංසරං දීඝමද්ධානං වණ්ණං කත්වා සුභාසුභං, x අලං තෙ තෙන පාපිම නිහතො ත්වමසි අන්තක.|saṁsaraṁ dīghamaddhānaṁ vaṇṇaṁ katvā subhāsubhaṁ, x alaṁ te tena pāpima nihato tvamasi antaka.|gatha
pali_0175|තීණි සොචෙය්යානි: කායසොචෙය්යං, වචීසොචෙය්යං, මනොසොචෙය්යං.|tīṇi soceyyāni: kāyasoceyyaṁ, vacīsoceyyaṁ, manosoceyyaṁ.|default
pali_2063|(ජම්බුඛාදකවග්ගෙ විය විත්ථාරෙතබ්බං.)|(jambukhādakavagge viya vitthāretabbaṁ.)|default
pali_1990|න ඛ්වාහං භගිනි, උද්ධං මුඛො භුඤ්ජාමීති.|na khvāhaṁ bhagini, uddhaṁ mukho bhuñjāmīti.|default
pali_1367|අට්ඨ ලොකධම්මා: ලාභො ච, අලාභො ච, යසො ච, අයසො ච, නින්දා ච, පසංසා ච, සුඛඤ්ච, දුක්ඛඤ්ච.|aṭṭha lokadhammā: lābho ca, alābho ca, yaso ca, ayaso ca, nindā ca, pasaṁsā ca, sukhañca, dukkhañca.|default
pali_2334|කතමෙහි චතූහි සොතාපත්තියඞ්ගෙහි සමන්නාගතො හොති?|katamehi catūhi sotāpattiyaṅgehi samannāgato hoti?|default
pali_0176|ආරභථ නික්ඛමථ යුඤ්ජථ බුද්ධසාසනෙ, x ධුනාථ මච්චුනො සෙනං නළාගාරංව කුඤ්ජරො.|ārabhatha nikkhamatha yuñjatha buddhasāsane, x dhunātha maccuno senaṁ naḷāgāraṁva kuñjaro.|gatha
pali_2064|කස්සකො පටිජානාසි න ච පස්සාමි තෙ කසිං, x කස්සකො පුච්ඡිතො බ්රූහි කථං ජානෙමු තං කසින්ති?|kassako paṭijānāsi na ca passāmi te kasiṁ, x kassako pucchito brūhi kathaṁ jānemu taṁ kasinti?|gatha
pali_0177|විධාසු න විකම්පන්ති - විප්පමුත්තා පුනබ්භවා x දන්තභූමිං අනුප්පත්තා - තෙ ලොකෙ විජිතාවිනො.|vidhāsu na vikampanti - vippamuttā punabbhavā x dantabhūmiṁ anuppattā - te loke vijitāvino.|gatha
pali_2802|තස්ස මය්හං භන්තෙ අහුදෙව කඞ්ඛා අහුදෙව විචිකිච්ඡා: කො සු නාම ඉමෙසං භවතං සමණබ්රාහ්මණානං සච්චං ආහ, කො මුසාති.|tassa mayhaṁ bhante ahudeva kaṅkhā ahudeva vicikicchā: ko su nāma imesaṁ bhavataṁ samaṇabrāhmaṇānaṁ saccaṁ āha, ko musāti.|default
pali_0947|කුලාකුලං පිණ්ඩිකාය චරන්තො ඉන්ද්රියගුත්තො නිපකො සතීමා, x සෙවෙථ පන්තානි සෙනාසනානි භයා පමුත්තො අභයෙ විමුත්තො.|kulākulaṁ piṇḍikāya caranto indriyagutto nipako satīmā, x sevetha pantāni senāsanāni bhayā pamutto abhaye vimutto.|gatha
pali_0178|කාරයෙ අස්සමෙ රම්මෙ වාසයෙත්ථ බහුස්සුතෙ, x පපඤ්ච විවනෙ කයිරා දුග්ගෙ සඞ්කමනානි ච.|kāraye assame ramme vāsayettha bahussute, x papañca vivane kayirā dugge saṅkamanāni ca.|gatha
pali_1873|නායං භික්ඛවෙ, කායො තුම්හාකං තාපි අඤ්ඤෙසං. පුරාණමිදං භික්ඛවෙ කම්මං අභිසඞ්ඛතං අභිසඤ්චෙතයිතං වෙදයිතං දට්ඨබ්බං.|nāyaṁ bhikkhave, kāyo tumhākaṁ tāpi aññesaṁ. purāṇamidaṁ bhikkhave kammaṁ abhisaṅkhataṁ abhisañcetayitaṁ vedayitaṁ daṭṭhabbaṁ.|default
pali_3221|සන්තාවුසො සත්තා සබ්බසො විඤ්ඤාණඤ්චායතනං සමතික්කම්ම නත්ථි කිඤ්චීති ආකිඤ්චඤ්ඤායතනූපගා. අයං සත්තමී විඤ්ඤාණට්ඨිති.|santāvuso sattā sabbaso viññāṇañcāyatanaṁ samatikkamma natthi kiñcīti ākiñcaññāyatanūpagā. ayaṁ sattamī viññāṇaṭṭhiti.|default
pali_0948|තයො භවා: කාමභවො, රූපභවො, අරූපභවො.|tayo bhavā: kāmabhavo, rūpabhavo, arūpabhavo.|default
pali_1647|චන්දං ව විමලං සුද්ධං විප්පසන්නමනාවිලං x නන්දීභවපරික්ඛීණං තමහං බ්රූමි බ්රාහ්මණං.|candaṁ va vimalaṁ suddhaṁ vippasannamanāvilaṁ x nandībhavaparikkhīṇaṁ tamahaṁ brūmi brāhmaṇaṁ.|gatha
pali_1648|මගධං ගතා කොසලං ගතා එකච්චියා පන වජ්ජිභූමියා, x මගා විය අසඞ්ගචාරිනො අනිකෙතා විහරන්ති භික්ඛවොති.|magadhaṁ gatā kosalaṁ gatā ekacciyā pana vajjibhūmiyā, x magā viya asaṅgacārino aniketā viharanti bhikkhavoti.|gatha
pali_2065|අලං බ්රාහ්මණ, කතම්මෙ අජ්ජ භත්තකිච්චං. අමුකස්මිං මෙ රුක්ඛමූලෙ දිවාවිහාරො භවිස්සති. තත්ථ ආගච්ඡෙය්යාසී'ති.|alaṁ brāhmaṇa, katamme ajja bhattakiccaṁ. amukasmiṁ me rukkhamūle divāvihāro bhavissati. tattha āgaccheyyāsī'ti.|default
pali_1874|කච්චි පන වො අනුරුද්ධා, සමග්ගා සම්මොදමානා අවිවදමානා ඛීරොදකීභූතා අඤ්ඤමඤ්ඤං පියචක්ඛූහි සම්පස්සන්තා විහරථාති?|kacci pana vo anuruddhā, samaggā sammodamānā avivadamānā khīrodakībhūtā aññamaññaṁ piyacakkhūhi sampassantā viharathāti?|default
pali_2460|ජානාමි ඛ්වාහං ආවුසො සත්තානං නිමොක්ඛං පමොක්ඛං විවෙකන්ති.|jānāmi khvāhaṁ āvuso sattānaṁ nimokkhaṁ pamokkhaṁ vivekanti.|default
pali_0179|තිස්සො සික්ඛා: අධිසීලසික්ඛා, අධිචිත්තසික්ඛා, අධිපඤ්ඤාසික්ඛා.|tisso sikkhā: adhisīlasikkhā, adhicittasikkhā, adhipaññāsikkhā.|default
pali_0180|අක්කොධනං වතවන්තං සීලවන්තං අනුස්සදං x දන්තං අන්තිමසාරීරං තමහං බ්රූමි බ්රාහ්මණං.|akkodhanaṁ vatavantaṁ sīlavantaṁ anussadaṁ x dantaṁ antimasārīraṁ tamahaṁ brūmi brāhmaṇaṁ.|gatha
pali_1991|තතියම්පි ඛො භගවා කොකාලිකං භික්ඛුං එතදවොච:. පෙසලා සාරිපුත්තමොග්ගල්ලානාති.|tatiyampi kho bhagavā kokālikaṁ bhikkhuṁ etadavoca:. pesalā sāriputtamoggallānāti.|default
pali_3454|යො භික්ඛවෙ, චක්ඛුසම්ඵස්සජාය වෙදනාය උප්පාදො ඨිති. යො මනොසම්ඵස්සජාය වෙදනාය උප්පාදො ඨිති. ජරාමරණස්ස පාතුභාවො.|yo bhikkhave, cakkhusamphassajāya vedanāya uppādo ṭhiti. yo manosamphassajāya vedanāya uppādo ṭhiti. jarāmaraṇassa pātubhāvo.|default
pali_1649|සච්චවිභඞ්ග සුත්තං එකාදසමං.|saccavibhaṅga suttaṁ ekādasamaṁ.|default
pali_0181|තිස්සො කුසලසඤ්ඤා: නෙක්ඛම්මසඤ්ඤා, අබ්යාපාදසඤ්ඤා, අවිහිංසාසඤ්ඤා.|tisso kusalasaññā: nekkhammasaññā, abyāpādasaññā, avihiṁsāsaññā.|default
pali_1368|යථා අඤ්ඤතරං බීජං ඛෙත්තෙ වුත්තං විරූහති, x පඨවීරසඤ්ච ආගම්ම සිනෙහඤ්ච තදූභයං.|yathā aññataraṁ bījaṁ khette vuttaṁ virūhati, x paṭhavīrasañca āgamma sinehañca tadūbhayaṁ.|gatha
pali_0182|පඤ්ච සුද්ධාවාසා: අවිහා අතප්පා සුදස්සා සුදස්සී අකනිට්ඨා.|pañca suddhāvāsā: avihā atappā sudassā sudassī akaniṭṭhā.|default
pali_2213|තඤ්චෙ භික්ඛවෙ, භික්ඛුං සෙඛං අප්පත්තමානසං ලාභසක්කාරසිලොකො අනුපාපුණාති, සො තස්ස හොති අන්තරායාය.|tañce bhikkhave, bhikkhuṁ sekhaṁ appattamānasaṁ lābhasakkārasiloko anupāpuṇāti, so tassa hoti antarāyāya.|default
pali_2066|රූපාදි අපච්චුපලක්ඛණ සුත්තානි|rūpādi apaccupalakkhaṇa suttāni|default
pali_0949|පණ්ඩිතො සීලසම්පන්නො ජලං අග්ගී ව භාසති x භොගෙ සංහරමානස්ස භමරස්සෙව ඉරීයතො x භොගා සන්නිචයං යන්ති වම්මිකො'වුපචීයති.|paṇḍito sīlasampanno jalaṁ aggī va bhāsati x bhoge saṁharamānassa bhamarasseva irīyato x bhogā sannicayaṁ yanti vammiko'vupacīyati.|gatha
pali_3005|අථ ඛො රාජකුමාර, බ්රහ්මා සහම්පති 'කතාවකාසො ඛොම්හි භගවතා ධම්මදෙසනායා'ති මං අභිවාදෙත්වා පදක්ඛිණං කත්වා තත්ථෙවන්තරධායි.|atha kho rājakumāra, brahmā sahampati 'katāvakāso khomhi bhagavatā dhammadesanāyā'ti maṁ abhivādetvā padakkhiṇaṁ katvā tatthevantaradhāyi.|default
pali_1369|'එථ ගණ්හථ බන්ධථ රාගෙන බන්ධමත්ථු වො, x සමන්තා පරිවාරෙථ මා වො මුඤ්චිත්ථ කොචි නං'.|'etha gaṇhatha bandhatha rāgena bandhamatthu vo, x samantā parivāretha mā vo muñcittha koci naṁ'.|gatha
pali_0183|කොසොහිතවත්ථගුය්හතාලක්ඛණං ()|kosohitavatthaguyhatālakkhaṇaṁ ()|default
pali_1506|සෙය්යථාපි භික්ඛවෙ, මහාරුක්ඛො. අථ පුරිසො ආගච්ඡෙය්ය කුද්දාලපිටකං ආදාය. ආයතිං අනුප්පාදධම්මො.|seyyathāpi bhikkhave, mahārukkho. atha puriso āgaccheyya kuddālapiṭakaṁ ādāya. āyatiṁ anuppādadhammo.|default
pali_1507|සක්යපුත්තො'ව ඣානෙන එකොදි නිපකො සතො, x අමතං මුනි ජිගිංසානො තමහං සුරියවච්චසෙ.|sakyaputto'va jhānena ekodi nipako sato, x amataṁ muni jigiṁsāno tamahaṁ suriyavaccase.|gatha
pali_3401|උපාදානං භික්ඛවෙ අජානතා අපස්සතා යථාභූතං. (යථාභූතංඤාණාය) සත්ථා පරියෙසිතබ්බාති.|upādānaṁ bhikkhave ajānatā apassatā yathābhūtaṁ. (yathābhūtaṁñāṇāya) satthā pariyesitabbāti.|default
pali_1370|'කෙ ආමගන්ධා මනුජෙසු බ්රහ්මෙ x එතෙ අවිද්වා ඉධ බ්රූහි ධීර, x කෙනාවුතා වාති පජා කුරූරා x ආපායිකා නිවුතබ්රහ්මලොකා'ති.|'ke āmagandhā manujesu brahme x ete avidvā idha brūhi dhīra, x kenāvutā vāti pajā kurūrā x āpāyikā nivutabrahmalokā'ti.|gatha
pali_3130|අථ ඛො ආයස්මා සාරිපුත්තො ධනඤ්ජානිං බ්රාහ්මණං සති උත්තරිං කරණීයෙ හීනෙ බ්රහ්මලොකෙ පතිට්ඨාපෙත්වා උට්ඨායාසනා පක්කාමි.|atha kho āyasmā sāriputto dhanañjāniṁ brāhmaṇaṁ sati uttariṁ karaṇīye hīne brahmaloke patiṭṭhāpetvā uṭṭhāyāsanā pakkāmi.|default
pali_3402|තිස්සො පඤ්ඤා: සෙක්ඛා පඤ්ඤා, අසෙක්ඛා පඤ්ඤා, නෙවසෙක්ඛානාසෙක්ඛා පඤ්ඤා.|tisso paññā: sekkhā paññā, asekkhā paññā, nevasekkhānāsekkhā paññā.|default
pali_2067|පඤ්චවෙදා සතං සමං x තපස්සී බ්රාහ්මණා චරං, x චිත්තඤ්ච නෙසං න සම්මා විමුත්තං x හීනත්තරූපා න පාරඞ්ගමා තෙ.|pañcavedā sataṁ samaṁ x tapassī brāhmaṇā caraṁ, x cittañca nesaṁ na sammā vimuttaṁ x hīnattarūpā na pāraṅgamā te.|gatha
pali_2151|පච්චත්තං ච සරීරෙසු මනුස්සෙස්වෙතං න විජ්ජති x වොකාරඤ්ච මනුස්සෙසු සමඤ්ඤාය පවුච්චති.|paccattaṁ ca sarīresu manussesvetaṁ na vijjati x vokārañca manussesu samaññāya pavuccati.|gatha
pali_2068|අනත්ථසංහිතං ඤත්වා යං කිඤ්චි අමරං තපං, x සබ්බං නත්ථාවහං හොති පියාරිත්තං ව ධම්මනි.|anatthasaṁhitaṁ ñatvā yaṁ kiñci amaraṁ tapaṁ, x sabbaṁ natthāvahaṁ hoti piyārittaṁ va dhammani.|gatha
pali_1371|ඉඞ්ඝ අඤ්ඤෙපි පුච්ඡස්සු පුථූ සමණබ්රාහ්මණෙ, x යදි සච්චා දමා චාගා ඛන්ත්යා භිය්යොධ විජ්ජතීති.|iṅgha aññepi pucchassu puthū samaṇabrāhmaṇe, x yadi saccā damā cāgā khantyā bhiyyodha vijjatīti.|gatha
pali_1372|දෙසෙතු මෙ භවං අග්ගිවෙස්සනො යථාසුතං යථාපරියත්තං ධම්මං, අප්පෙවනාමාහං භොතො අග්ගිවෙස්සනස්ස භාසිතස්ස අත්ථං ආජානෙය්යන්ති.|desetu me bhavaṁ aggivessano yathāsutaṁ yathāpariyattaṁ dhammaṁ, appevanāmāhaṁ bhoto aggivessanassa bhāsitassa atthaṁ ājāneyyanti.|default
pali_1198|ඛත්තියො දිපදං සෙට්ඨො බලිවද්දො චතුප්පදං, x කොමාරී සෙට්ඨා භරියානං යො ච පුත්තාන පුබ්බජොති.|khattiyo dipadaṁ seṭṭho balivaddo catuppadaṁ, x komārī seṭṭhā bhariyānaṁ yo ca puttāna pubbajoti.|gatha
pali_3006|අථ ඛො භික්ඛවෙ වෙපචිත්ති අසුරින්දො සක්කස්ස දෙවානමින්දස්ස චෙතසා චෙතොපරිවිතක්කමඤ්ඤාය යෙන සක්කො දෙවානමින්දො තෙනුපසඞ්කමි.|atha kho bhikkhave vepacitti asurindo sakkassa devānamindassa cetasā cetoparivitakkamaññāya yena sakko devānamindo tenupasaṅkami.|default
pali_3089|යො ච දීඝං ව රස්සං වා අණුං ථූලං සුභාසුභං x ලොකෙ අදින්නං නාදියති තමහං බ්රූමි බ්රාහ්මණං.|yo ca dīghaṁ va rassaṁ vā aṇuṁ thūlaṁ subhāsubhaṁ x loke adinnaṁ nādiyati tamahaṁ brūmi brāhmaṇaṁ.|gatha
pali_1875|අථ ඛො ආයස්මා වක්කලි අචිරපක්කන්තෙසු තෙසු භික්ඛූසු සත්ථං ආහරෙසි.|atha kho āyasmā vakkali acirapakkantesu tesu bhikkhūsu satthaṁ āharesi.|default
