pali_0771|යෙහි ජාතෙහි නන්දිස්සං යෙසඤ්ච භවමිච්ඡිසං, x තෙ මං දාරෙහි සම්පුච්ඡ සාව වාරෙන්ති සූකරං.|yehi jātehi nandissaṁ yesañca bhavamicchisaṁ, x te maṁ dārehi sampuccha sāva vārenti sūkaraṁ.|gatha
pali_2228|අථ භන්තෙ, බ්රහ්මා සනංකුමාරො දෙවානං තාවතිංසානං සම්පසාදං විදිත්වා අන්තරහිතො ඉමාහි ගාථාහි අනුමොදි:|atha bhante, brahmā sanaṁkumāro devānaṁ tāvatiṁsānaṁ sampasādaṁ viditvā antarahito imāhi gāthāhi anumodi:|default
pali_2929|සන්තාවුසො, සත්තා අසඤ්ඤිනො අප්පටිසංවෙදිනො සෙය්යථාපි දෙවා අසඤ්ඤසත්තා. අයං පඤ්චමො සත්තාවාසො.|santāvuso, sattā asaññino appaṭisaṁvedino seyyathāpi devā asaññasattā. ayaṁ pañcamo sattāvāso.|default
pali_0772|යථා සාකටිකො පන්ථං සමං හිත්වා මහාපථං, x විසමං මග්ගමාරුය්හ අක්ඛච්ඡින්නොව ඣායති.|yathā sākaṭiko panthaṁ samaṁ hitvā mahāpathaṁ, x visamaṁ maggamāruyha akkhacchinnova jhāyati.|gatha
pali_2930|මහාවච්ඡගොත්තසුත්තං තතියං.|mahāvacchagottasuttaṁ tatiyaṁ.|default
pali_0273|ඡ තණ්හාකායා: රූපතණ්හා, සද්දතණ්හා, ගන්ධතණ්හා, රසතණ්හා, ඵොට්ඨබ්බතණ්හා, ධම්මතණ්හා.|cha taṇhākāyā: rūpataṇhā, saddataṇhā, gandhataṇhā, rasataṇhā, phoṭṭhabbataṇhā, dhammataṇhā.|default
pali_2729|කස්සච්චයා න විජ්ජන්ති කස්ස නත්ථි අපාගතං x කො සම්මොහමාපාදි කො වා ධීරො සදා සතොති.|kassaccayā na vijjanti kassa natthi apāgataṁ x ko sammohamāpādi ko vā dhīro sadā satoti.|gatha
pali_1016|කති ජාගරතං සුත්තා කති සුත්තෙසු ජාගරා, x කතීහි රජමාදෙති කතීහි පරිසුජ්ඣතීති.|kati jāgarataṁ suttā kati suttesu jāgarā, x katīhi rajamādeti katīhi parisujjhatīti.|gatha
pali_0274|පච්චය (පච්චයුප්පන්න) සුත්තං|paccaya (paccayuppanna) suttaṁ|default
pali_1220|චත්තාරි පඤ්හබ්යාකරණානි: එකංසබ්යාකරණීයො පඤ්හො, පටිපුච්ඡාබ්යාකරණීයො පඤ්හො, විභජ්ජබ්යාකරණීයො පඤ්හො, ඨපනීයො පඤ්හො.|cattāri pañhabyākaraṇāni: ekaṁsabyākaraṇīyo pañho, paṭipucchābyākaraṇīyo pañho, vibhajjabyākaraṇīyo pañho, ṭhapanīyo pañho.|default
pali_1421|වෙස්සභුස්ස නමත්ථු නහාතකස්ස තපස්සිනො x නමත්ථු කකුසන්ධස්ස මාරසෙනාපමද්දිනො|vessabhussa namatthu nahātakassa tapassino x namatthu kakusandhassa mārasenāpamaddino|gatha
pali_0275|එකෙකලොමතාඋණ්ණාලක්ඛණාදීනි. ( )|ekekalomatāuṇṇālakkhaṇādīni. ( )|default
pali_1017|අනනදානාදි සාරගන්ධාදි සුත්තානි|ananadānādi sāragandhādi suttāni|default
pali_2931|අථ ඛො ආයස්මා වඞ්ගීසො ආයස්මන්තං අඤ්ඤාකොණ්ඩඤ්ඤං භගවතො සම්මුඛා සරූපාහි ගාථාහි අභිත්ථවි.|atha kho āyasmā vaṅgīso āyasmantaṁ aññākoṇḍaññaṁ bhagavato sammukhā sarūpāhi gāthāhi abhitthavi.|default
pali_0773|ආරාමරොපා වනරොපා යෙ ජනා සෙතුකාරකා, x පපඤ්ච උදපානඤ්ච යෙ දදන්ති උපස්සයං.|ārāmaropā vanaropā ye janā setukārakā, x papañca udapānañca ye dadanti upassayaṁ.|gatha
pali_1999|සබ්බෙ සද්ධම්මගරුනො විහංසු විහරන්ති ච, x අථොපි විහරිස්සන්ති එසා බුද්ධාන ධම්මතා.|sabbe saddhammagaruno vihaṁsu viharanti ca, x athopi viharissanti esā buddhāna dhammatā.|gatha
pali_2932|ඛත්තියො සෙට්ඨො ජනෙතස්මිං, x යෙ ගොත්තපටිසාරිනො,විජ්ජාචරණසම්පන්නො, සො සෙට්ඨො දෙවමානුසෙ.|khattiyo seṭṭho janetasmiṁ, x ye gottapaṭisārino,vijjācaraṇasampanno, so seṭṭho devamānuse.|gatha
pali_1018|අන්නං පානං ඛාදනීයං වත්ථසෙනාසනානි ච, x දදෙය්ය උජුභූතෙසු විප්පසන්නෙන චෙතසා.|annaṁ pānaṁ khādanīyaṁ vatthasenāsanāni ca, x dadeyya ujubhūtesu vippasannena cetasā.|gatha
pali_2229|පුරිමඤ්ච දිසං රාජා ධතරට්ඨො පසාසති. x ගන්ධබ්බානං ආධිපති මහාරාජා යසස්සි සො.|purimañca disaṁ rājā dhataraṭṭho pasāsati. x gandhabbānaṁ ādhipati mahārājā yasassi so.|gatha
pali_3415|වාරිපොක්ඛරපත්තෙව ආරග්ගෙරිව සාසපො x යො න ලිප්පති කාමෙසු තමහං බ්රූමි බ්රාහ්මණං.|vāripokkharapatteva āraggeriva sāsapo x yo na lippati kāmesu tamahaṁ brūmi brāhmaṇaṁ.|gatha
pali_0276|එකාහි දාඨා තිදිවෙහි පූජිතා x එකා පන ගන්ධාරපුරෙ මහීයති, x කාලිඞ්ගරඤ්ඤො විජිතෙ පුනෙකං x එකං පුන නාගරාජා මහෙන්ති.|ekāhi dāṭhā tidivehi pūjitā x ekā pana gandhārapure mahīyati, x kāliṅgarañño vijite punekaṁ x ekaṁ puna nāgarājā mahenti.|gatha
pali_2480|කති ලොකස්මිං පජ්ජොතා යෙහි ලොකො පකාසති, x භවන්තං පුට්ඨුමාගම්ම කථං ජානෙමු තං මයන්ති.|kati lokasmiṁ pajjotā yehi loko pakāsati, x bhavantaṁ puṭṭhumāgamma kathaṁ jānemu taṁ mayanti.|gatha
pali_1687|මානං පහාය සුසමාහිතත්තො සුචෙතසො සබ්බධි විප්පමුත්තො, x එකො අරඤ්ඤෙ විහරං අප්පමත්තො ස මච්චුධෙය්යස්ස තරෙය්ය පාරන්ති.|mānaṁ pahāya susamāhitatto sucetaso sabbadhi vippamutto, x eko araññe viharaṁ appamatto sa maccudheyyassa tareyya pāranti.|gatha
pali_3134|ඉති ඛො භික්ඛවෙ සක්කස්ස දෙවානමින්දස්ස ධම්මෙනෙව ජයො අහොසි.|iti kho bhikkhave sakkassa devānamindassa dhammeneva jayo ahosi.|default
pali_1019|අප්පස්මෙකෙ පවෙච්ඡන්ති බහුනෙකෙ න දිච්ඡරෙ, x අප්පස්මා දක්ඛිණා දින්නා සහස්සෙන සමං මිතාති.|appasmeke pavecchanti bahuneke na dicchare, x appasmā dakkhiṇā dinnā sahassena samaṁ mitāti.|gatha
pali_2481|විඤ්ඤාණ අනුපලක්ඛණ සුත්තං|viññāṇa anupalakkhaṇa suttaṁ|default
pali_3016|රසා නිච්චා වා අනිච්චා වා'ති.|rasā niccā vā aniccā vā'ti.|default
pali_1422|ඉච්ඡාය බජ්ඣති ලොකො ඉච්ඡාවිනයාය මුච්චති, x ඉච්ඡාය විප්පහානෙන සබ්බං ඡින්දති බන්ධනන්ති.|icchāya bajjhati loko icchāvinayāya muccati, x icchāya vippahānena sabbaṁ chindati bandhananti.|gatha
pali_1688|අරහාතිස්ස වචනීයං. යොයං ආයස්මා එවංනාමො එවංගොත්තො. අයං වුච්චති රාධ, පරිඤ්ඤාතාවී පුග්ගලොති.|arahātissa vacanīyaṁ. yoyaṁ āyasmā evaṁnāmo evaṁgotto. ayaṁ vuccati rādha, pariññātāvī puggaloti.|default
pali_1020|විපුලො රාජගහීයානං ගිරි සෙට්ඨො පවුච්චති, x සෙතො හිමවතං සෙට්ඨො ආදිච්චො අඝගාමිනං.|vipulo rājagahīyānaṁ giri seṭṭho pavuccati, x seto himavataṁ seṭṭho ādicco aghagāminaṁ.|gatha
pali_2730|චතස්සො ඉමා භික්ඛවෙ, ධාතුයො. කතමා චතස්සො? පඨවීධාතු ආපොධාතු තෙජොධාතු වායොධාතු.|catasso imā bhikkhave, dhātuyo. katamā catasso? paṭhavīdhātu āpodhātu tejodhātu vāyodhātu.|default
pali_1221|අඤ්ඤෙන ච කෙවලිනං මහෙසිං ඛීණාසවං කුක්කුච්ච වූපසන්තං, x අන්නෙන පානෙන උපට්ඨහස්සු ඛෙත්තඤ්හි තං පුඤ්ඤපෙක්ඛස්ස හොතීති.|aññena ca kevalinaṁ mahesiṁ khīṇāsavaṁ kukkucca vūpasantaṁ, x annena pānena upaṭṭhahassu khettañhi taṁ puññapekkhassa hotīti.|gatha
pali_3017|යො ච භික්ඛවෙ, රූපානං නිරොධො වූපසමො අත්ථගමො, දුක්ඛස්සෙසො නිරොධො, රොගානං වූපසමො, ජරාමරණස්ස අත්ථගමොති.|yo ca bhikkhave, rūpānaṁ nirodho vūpasamo atthagamo, dukkhasseso nirodho, rogānaṁ vūpasamo, jarāmaraṇassa atthagamoti.|default
pali_1222|ලාභා භන්තෙ, ඝටීකාරස්ස කුම්භකාරස්ස, සුලද්ධං, භන්තෙ, ඝටීකාරස්ස කුම්භකාරස්ස යස්ස භගවා එවං අභිවිස්සත්ථොති.|lābhā bhante, ghaṭīkārassa kumbhakārassa, suladdhaṁ, bhante, ghaṭīkārassa kumbhakārassa yassa bhagavā evaṁ abhivissatthoti.|default
pali_2101|අථ ඛො භික්ඛවෙ වෙපචිත්ති අසුරින්දො සක්කං දෙවානමින්දං එතදවොච: භණ දෙවානමින්ද, ගාථන්ති.|atha kho bhikkhave vepacitti asurindo sakkaṁ devānamindaṁ etadavoca: bhaṇa devānaminda, gāthanti.|default
pali_3322|අථ ඛො භගවා රාජානං පසෙනදිං කොසලං අනත්තමනං විදිත්වා තායං වෙලායං ඉමා ගාථායො අභාසි:|atha kho bhagavā rājānaṁ pasenadiṁ kosalaṁ anattamanaṁ viditvā tāyaṁ velāyaṁ imā gāthāyo abhāsi:|default
pali_1522|යාය සද්ධා පබ්බජිතො අගාරස්මානගාරියං, x තමෙව සද්ධං බ්රූහෙහි මා නිද්දාය වසඞ්ගමීති.|yāya saddhā pabbajito agārasmānagāriyaṁ, x tameva saddhaṁ brūhehi mā niddāya vasaṅgamīti.|gatha
pali_1913|යෙසං ධම්මා අප්පටිවිදිතා පරවාදෙසු නීයරෙ, x සුත්තා තෙ නප්පබුජ්ඣන්ති කාලො තෙසං පබුජ්ඣිතුන්ති.|yesaṁ dhammā appaṭividitā paravādesu nīyare, x suttā te nappabujjhanti kālo tesaṁ pabujjhitunti.|gatha
pali_1689|කොධං ජහෙ විප්පජහෙය්ය මානං සංයොජනං සබ්බමතික්කමෙය්ය, x තං නාමරූපස්මිමසජ්ජමානං අකිඤ්චනං නානුපතන්ති දුක්ඛා.|kodhaṁ jahe vippajaheyya mānaṁ saṁyojanaṁ sabbamatikkameyya, x taṁ nāmarūpasmimasajjamānaṁ akiñcanaṁ nānupatanti dukkhā.|gatha
pali_2482|විඤ්ඤාණ අපච්චක්ඛකම්ම සුත්තං|viññāṇa apaccakkhakamma suttaṁ|default
pali_1690|'දදතො පුඤ්ඤං පවඩ්ඪති සඤ්ඤමතො වෙරං න චීයති, x කුසලො ච ජහාති පාපකං රාගදොසමොහක්ඛයා ස නිබ්බුතො'ති.|'dadato puññaṁ pavaḍḍhati saññamato veraṁ na cīyati, x kusalo ca jahāti pāpakaṁ rāgadosamohakkhayā sa nibbuto'ti.|gatha
pali_0774|අප්පකො වත මෙ සන්තො කාමො වෙල්ලිතකෙසියා, x අනෙකභාවො සමපාදි අරහන්තෙ'ව දක්ඛිණා.|appako vata me santo kāmo vellitakesiyā, x anekabhāvo samapādi arahante'va dakkhiṇā.|gatha
pali_1691|සතඤ්ච විවටං හොති ආලොකො පස්සතාමිච x සන්තිකෙ න විජානන්ති මගා ධම්මස්ස අකොවිදා.|satañca vivaṭaṁ hoti āloko passatāmica x santike na vijānanti magā dhammassa akovidā.|gatha
pali_1021|ඛත්තියා භොගී රාජානො අනුයුත්තා භවන්තු තෙ, x රාජාභිරාජා මනුජින්දො රජ්ජං කාරෙහි ගොතම.|khattiyā bhogī rājāno anuyuttā bhavantu te, x rājābhirājā manujindo rajjaṁ kārehi gotama.|gatha
pali_2348|තාදිසො පුරිසො රාජ මීයමානො ජනාධිප, x උපෙති නිරයං ඝොරං තමොතමපරායණො.|tādiso puriso rāja mīyamāno janādhipa, x upeti nirayaṁ ghoraṁ tamotamaparāyaṇo.|gatha
pali_1692|සුත්තන්තා අන්තරපෙය්යාලා නිට්ඨිතා.|suttantā antarapeyyālā niṭṭhitā.|default
pali_2230|යො හවෙ දහරො භික්ඛු යුඤ්ජති බුද්ධසාසනෙ, x සො ඉමං ලොකං පභාසෙති අබ්භා මුත්තොව චන්දිමා.|yo have daharo bhikkhu yuñjati buddhasāsane, x so imaṁ lokaṁ pabhāseti abbhā muttova candimā.|gatha
pali_0775|උපාදානෙ භයං දිස්වා ජාතිමරණ සම්භවෙ, x අනුපාදා විමුච්චන්ති ජාතිමරණසඞ්ඛයෙ.|upādāne bhayaṁ disvā jātimaraṇa sambhave, x anupādā vimuccanti jātimaraṇasaṅkhaye.|gatha
pali_1523|නාමං චිත්තඤ්ච තණ්හා ච සංයොජනඤ්ච බන්ධනා, x අබ්භාහතුඩ්ඩිතො පිහිතො ඉච්ඡා ලොකෙන තෙ දසාති.|nāmaṁ cittañca taṇhā ca saṁyojanañca bandhanā, x abbhāhatuḍḍito pihito icchā lokena te dasāti.|gatha
pali_1223|දානඤ්ච යුද්ධඤ්ච සමානමාහු අප්පාපි සන්තා බහුකෙ ජිනන්ති, x අප්පම්පි චෙ සද්දහානො දදාති තෙනෙව සො හොති සුඛී පරත්ථාති.|dānañca yuddhañca samānamāhu appāpi santā bahuke jinanti, x appampi ce saddahāno dadāti teneva so hoti sukhī paratthāti.|gatha
pali_2820|බහුධාතුකසුත්තං පඤ්චමං.|bahudhātukasuttaṁ pañcamaṁ.|default
pali_1423|බුද්ධො ධම්මමදෙසෙසි ජාතියා සමතික්කමං, x සබ්බදුක්ඛප්පහාණාය යො මං සච්චෙ නිවෙසයි.|buddho dhammamadesesi jātiyā samatikkamaṁ, x sabbadukkhappahāṇāya yo maṁ sacce nivesayi.|gatha
pali_1524|භෙත්වා අවිජ්ජං විජ්ජාය ආසවානං පරික්ඛයා, x අසොකං අනුපායාසං කස්මා පබ්බජිතං තපෙ.|bhetvā avijjaṁ vijjāya āsavānaṁ parikkhayā, x asokaṁ anupāyāsaṁ kasmā pabbajitaṁ tape.|gatha
pali_2349|යෙසං වෙ දුල්ලභො ලොකෙ පාතුභාවො අභිණ්හසො, x සොහං බ්රාහ්මණ සම්බුද්ධො සල්ලකත්තො අනුත්තරො.|yesaṁ ve dullabho loke pātubhāvo abhiṇhaso, x sohaṁ brāhmaṇa sambuddho sallakatto anuttaro.|gatha
pali_1693|නන්දි සංයොජනො ලොකො විතක්කස්ස විචාරණං, x තණ්හාය විප්පහාණෙන නිබ්බාණමිති වුච්චතීති.|nandi saṁyojano loko vitakkassa vicāraṇaṁ, x taṇhāya vippahāṇena nibbāṇamiti vuccatīti.|gatha
pali_1525|එවං වුත්තෙ උත්තරො මාණවො පාරාසරියන්තෙවාසී තුණ්හීභූතො මඞ්කුභූතො පත්තක්ඛන්ධො අධොමුඛො පජ්ඣායන්තො අප්පටිභානො නිසීදි.|evaṁ vutte uttaro māṇavo pārāsariyantevāsī tuṇhībhūto maṅkubhūto pattakkhandho adhomukho pajjhāyanto appaṭibhāno nisīdi.|default
pali_0277|තෙ ඛෙමප්පත්තා සුඛිනො දිට්ඨධම්මාභිනිබ්බුතා, x සබ්බවෙරභයාතීතා සබ්බදුක්ඛං උපච්චගුන්ති.|te khemappattā sukhino diṭṭhadhammābhinibbutā, x sabbaverabhayātītā sabbadukkhaṁ upaccagunti.|gatha
pali_3055|එවං පස්සං භික්ඛවෙ, සුතවා අරියසාවකො රූපස්මිම්පි නිබ්බින්දති,. නාපරං ඉත්ථත්තායාති පජානාතීති.|evaṁ passaṁ bhikkhave, sutavā ariyasāvako rūpasmimpi nibbindati,. nāparaṁ itthattāyāti pajānātīti.|default
pali_1224|උට්ඨානකො අනලසො ආපදාසු න වෙධති, x අච්ඡින්නවුත්ති මෙධාවී තාදිසො ලභතෙ යසං.|uṭṭhānako analaso āpadāsu na vedhati, x acchinnavutti medhāvī tādiso labhate yasaṁ.|gatha
pali_0278|දහරා ත්වං රූපවතී අහඤ්ච දහරො සුසු, x පඤ්චඞ්ගිකෙන තුරියෙන එහය්යෙභිරමාමසෙති|daharā tvaṁ rūpavatī ahañca daharo susu, x pañcaṅgikena turiyena ehayyebhiramāmaseti|gatha
pali_1424|මඤ්ඤමානො ඛො භික්ඛු, බද්ධො මාරස්ස, අමඤ්ඤමානො මුත්තො පාපිමතො'ති.|maññamāno kho bhikkhu, baddho mārassa, amaññamāno mutto pāpimato'ti.|default
pali_2350|තතො කීටෙ පටඞ්ගෙ ච යාව කුන්ථකිපිල්ලිකෙ x ලිඞ්ගං ජාතිමයං තෙසං අඤ්ඤමඤ්ඤා හි ජාතියො.|tato kīṭe paṭaṅge ca yāva kunthakipillike x liṅgaṁ jātimayaṁ tesaṁ aññamaññā hi jātiyo.|gatha
pali_3323|යතො වා භික්ඛු ආතාපී සම්පජඤ්ඤං න රිඤ්චති x තතො සො වෙදනා සබ්බා පරිජානාති පණ්ඩිතො.|yato vā bhikkhu ātāpī sampajaññaṁ na riñcati x tato so vedanā sabbā parijānāti paṇḍito.|gatha
pali_0279|පූජිතො පූජනෙය්යානං සක්කරෙය්යාන සක්කතො, x අපචිතො අපචෙය්යානං තස්ස ඉච්ඡාමි හාතවෙති.|pūjito pūjaneyyānaṁ sakkareyyāna sakkato, x apacito apaceyyānaṁ tassa icchāmi hātaveti.|gatha
pali_0280|ඉධෙව චිත්තානි විරාජයිත්වා කාමෙසු ආදීනවමද්දසංසු, x තෙ කාමසංයොජනබන්ධනානි පාපිමයොගානි දුරච්චයානි.|idheva cittāni virājayitvā kāmesu ādīnavamaddasaṁsu, x te kāmasaṁyojanabandhanāni pāpimayogāni duraccayāni.|gatha
pali_2731|ය්වායං භිසානි ඛණති පුණ්ඩරීකානි භඤ්ජති, x එවං ආකිණ්ණකම්මන්තො කස්මා එසො න වුච්චතීති.|yvāyaṁ bhisāni khaṇati puṇḍarīkāni bhañjati, x evaṁ ākiṇṇakammanto kasmā eso na vuccatīti.|gatha
pali_1425|කොධං ජහෙ විප්පජහෙය්ය මානං සංයොජනං සබ්බමතික්කමෙය්ය, x තං නාමරූපස්මිමසජ්ජමානං අකිඤ්චනං නානුපතන්ති සඞ්ගාති.|kodhaṁ jahe vippajaheyya mānaṁ saṁyojanaṁ sabbamatikkameyya, x taṁ nāmarūpasmimasajjamānaṁ akiñcanaṁ nānupatanti saṅgāti.|gatha
pali_1426|සාවකො තෙ මහාවීර මරණං මරණාභිභූ, x ආකඞ්ඛති චෙතයති තං නිසෙධ ජුතින්ධර.|sāvako te mahāvīra maraṇaṁ maraṇābhibhū, x ākaṅkhati cetayati taṁ nisedha jutindhara.|gatha
pali_1427|යඤ්චස්ස භුඤ්ජතෙ මාතා අන්නං පානඤ්ච භොජනං, x තෙන සො තත්ථ යාපෙති මාතුකුච්ඡිගතො නරොති.|yañcassa bhuñjate mātā annaṁ pānañca bhojanaṁ, x tena so tattha yāpeti mātukucchigato naroti.|gatha
pali_2649|ගොපකමොග්ගල්ලානසුත්තං අට්ඨමං|gopakamoggallānasuttaṁ aṭṭhamaṁ|default
pali_0281|බාහුකං අධිකක්කඤ්ච ගයං සුන්දරිකාමපී, x සරස්සතිං පයාගඤ්ච අථො බාහුමතිං නදිං.|bāhukaṁ adhikakkañca gayaṁ sundarikāmapī, x sarassatiṁ payāgañca atho bāhumatiṁ nadiṁ.|gatha
pali_1694|ඉදං සුත්වාන මඝවා දෙවරාජා සුජම්පති, x භික්ඛුසඞ්ඝං නමස්සිත්වා පමුඛො රථමාරුහීති.|idaṁ sutvāna maghavā devarājā sujampati, x bhikkhusaṅghaṁ namassitvā pamukho rathamāruhīti.|gatha
pali_2650|සන්දකසුත්තං ඡට්ඨං.|sandakasuttaṁ chaṭṭhaṁ.|default
pali_1428|මාතුගාමො ච කල්යාණී එකපුත්තෙක ධීතු ච x සමණබ්රාහ්මණා තීණි ඡවි රජ්ජු ච භික්ඛු චෙති.|mātugāmo ca kalyāṇī ekaputteka dhītu ca x samaṇabrāhmaṇā tīṇi chavi rajju ca bhikkhu ceti.|gatha
pali_1022|නයිදං සිථිලමාරබ්භ නයිදං අප්පෙන ථාමසා,නිබ්බානං අධිගන්තබ්බං සබ්බගන්ථප්පමොචනං.|nayidaṁ sithilamārabbha nayidaṁ appena thāmasā,nibbānaṁ adhigantabbaṁ sabbaganthappamocanaṁ.|default
pali_0282|ඉත්වෙව චොරො අසිආවුධඤ්ච x සොබ්භෙ පපාතෙ නරකෙ අන්වකාරි, x අවන්දි චොරො සුගතස්ස පාදෙ x තත්ථෙව නං පබ්බජ්ජං අයාචි.|itveva coro asiāvudhañca x sobbhe papāte narake anvakāri, x avandi coro sugatassa pāde x tattheva naṁ pabbajjaṁ ayāci.|gatha
pali_1023|එකස්ස චරිතං සෙය්යො නත්ථි බාලෙ සහායතා, x එකො චරෙ න ච පාපානි කයිරා අප්පොස්සුක්කො මාතඞ්ග රඤ්ඤෙව නාගොති.|ekassa caritaṁ seyyo natthi bāle sahāyatā, x eko care na ca pāpāni kayirā appossukko mātaṅga raññeva nāgoti.|gatha
pali_2858|දීඝනඛසුත්තං චතුත්ථං.|dīghanakhasuttaṁ catutthaṁ.|default
pali_3018|රට්ඨපාලසුත්තං දුතියං.|raṭṭhapālasuttaṁ dutiyaṁ.|default
pali_2231|ඝටීකාරො ඛො මහාරාජ, කුම්භකාරො එකභත්තිකො බ්රහ්මචාරී සීලවා කල්යාණධම්මො.|ghaṭīkāro kho mahārāja, kumbhakāro ekabhattiko brahmacārī sīlavā kalyāṇadhammo.|default
pali_1914|අඩ්ඪො චෙ පුරිසො රාජ අස්සද්ධො හොති මච්ඡරී, x කදරියො පාපසඞ්කප්පො මිච්ඡාදිට්ඨි අනාදරො.|aḍḍho ce puriso rāja assaddho hoti maccharī, x kadariyo pāpasaṅkappo micchādiṭṭhi anādaro.|gatha
pali_1526|අපරෙ පි චත්තාරො පුග්ගලා: තමොතමපරායනො, තමොජොතිපරායනො, ජොතිතමපරායනො, ජොතිජොතිපරායනො.|apare pi cattāro puggalā: tamotamaparāyano, tamojotiparāyano, jotitamaparāyano, jotijotiparāyano.|default
